{
  "run_id": "RUN-AAA-T17-P09-REMEDIATION-20260816-001",
  "process_id": "AAA-T17-P09-REMEDIATION",
  "work_order_id": "WO-AAA-T17-P09-REMEDIATION-20260816",
  "responsible_persona": "SEMI-CONTROL-ARCHITECT",
  "executor_role": "ENGINEERING",
  "state": "COMPLETED_PASS",
  "repository": "AofSpds/asset-agent-asa",
  "exact_base_commit": "30fdb278c218b24e44d66eb5f47935a196dc4f8c",
  "branch": "aaa-integration-v0.2",
  "started_at": "2026-08-16T06:27:12+09:00",
  "last_heartbeat_at": "2026-08-16T06:28:41+09:00",
  "stale_after_seconds": 7200,
  "canonical_output": false,
  "terminal_result": {
    "result_id": "RESULT-AAA-T17-P09-REMEDIATION-v0.1",
    "result_sha256": "cffdb605a8ab0762e0859dd13c5a88aa01022c9a7b81b64d6ff88a3ffbdc2086",
    "completed_at": "2026-08-16T06:28:41+09:00",
    "persistent_locator": "control/aaa/results/RESULT-AAA-T17-P09-REMEDIATION-v0.1.json",
    "verdict": "PASS"
  },
  "notes": [
    "Bounded remediation closes the five P09 findings at engineering level only.",
    "Integration candidate 1921c8f97714b9cc0eda821c80246a5d5dc93d78 passed 115/115 and Owner Console locked install/build.",
    "PR #29 merged as exact successor 30fdb278c218b24e44d66eb5f47935a196dc4f8c and integration push CI run 31909527442 passed.",
    "Independent Validation PASS is not claimed; a new independent P09 rerun is required.",
    "Original failed validation target 80378610f9ac9e688c52417f0416e01c057400a7 remains preserved."
  ]
}
