{
  "branch": "aaa-t19-execution-runtime-v0.1",
  "canonical_output": false,
  "exact_base_commit": "acbd983682b9ded0a040008923812e3f88746e23",
  "executor_role": "ENGINEERING",
  "last_heartbeat_at": "2026-08-16T07:38:10+09:00",
  "notes": [
    "Bounded T19 engineering implementation only; live worker execution authority remains disabled.",
    "Exact engineering target acbd983682b9ded0a040008923812e3f88746e23 passed 142/142 deterministic tests and GitHub Actions run 31912624715.",
    "PostgreSQL 16 certifying drills passed including T19 two-worker single-winner claim, claim-not-running, JSON Registry 7/7 reconciliation, and local backup/restore.",
    "No existing P09 or T18 validation Run received retroactive ACK/start/heartbeat/result evidence.",
    "Independent Validation PASS, PostgreSQL Operational SoT cutover, Production Release, P10 Controlled Cutover, and T19 live execution enablement are not claimed."
  ],
  "process_id": "AAA-T19-EXECUTION-RUNTIME",
  "repository": "AofSpds/asset-agent-asa",
  "responsible_persona": "SEMI-CONTROL-ARCHITECT",
  "run_id": "RUN-AAA-T19-EXECUTION-RUNTIME-20260816-001",
  "stale_after_seconds": 7200,
  "started_at": "2026-08-16T07:20:00+09:00",
  "state": "COMPLETED_WITH_FINDINGS",
  "terminal_result": {
    "completed_at": "2026-08-16T07:38:10+09:00",
    "persistent_locator": "control/aaa/results/RESULT-AAA-T19-EXECUTION-RUNTIME-v0.1.json",
    "result_id": "RESULT-AAA-T19-EXECUTION-RUNTIME-v0.1",
    "result_sha256": "8517a873fdaf485d2b7c6e8b7baf4f86ec56d4b31176e4d0a651a30a1efd5937",
    "verdict": "PASS_WITH_FINDINGS"
  },
  "work_order_id": "WO-AAA-T19-EXECUTION-RUNTIME-v0.1-20260816"
}
